{
  "$schema": "../../../schemas/consensus-file.schema.json",
  "dataVersion": "3.3-r1",
  "method": "Solo claims \"current\" atribuidos a fuentes externas y declarados para el parche actual (se excluyen estimaciones internas). Tiers: se agrupan por agente+rol+modo del parche actual y se exige ≥2 fuentes distintas; score = media de las posiciones normalizadas de cada escala; agreement = \"agree\" si max-min ≤ 0.2. Equipos: misma composición y modo citada por ≥2 fuentes distintas. Es una agregación aproximada: las escalas de cada fuente no son equivalentes.",
  "teams": [
    {
      "collectionMethod": "derived",
      "derivedFrom": [
        "clm_team_16f057765c32",
        "clm_team_213e4af633df"
      ],
      "evidenceType": "cross_source_consensus",
      "id": "cns_team_d92021e16ce1",
      "members": [
        "ellen",
        "lycaon",
        "soukaku"
      ],
      "mode": "shiyu_defense",
      "patch": "3.3",
      "sources": [
        "example-guide-a",
        "example-stats-b"
      ]
    }
  ],
  "tiers": [
    {
      "agent": "ellen",
      "agreement": "agree",
      "collectionMethod": "derived",
      "derivedFrom": [
        "clm_tier_29689aa407f5",
        "clm_tier_74d759b5e13b"
      ],
      "entries": [
        {
          "claimId": "clm_tier_29689aa407f5",
          "score": 1,
          "sourceId": "example-guide-a",
          "tier": "T0"
        },
        {
          "claimId": "clm_tier_74d759b5e13b",
          "score": 0.8,
          "sourceId": "example-stats-b",
          "tier": "S"
        }
      ],
      "evidenceType": "cross_source_consensus",
      "id": "cns_tier_1cf3288a99f8",
      "maxScore": 1,
      "meanScore": 0.9,
      "minScore": 0.8,
      "mode": "shiyu_defense",
      "patch": "3.3",
      "role": "attack"
    },
    {
      "agent": "miyabi",
      "agreement": "mixed",
      "collectionMethod": "derived",
      "derivedFrom": [
        "clm_tier_998ee1662a55",
        "clm_tier_baccc092f287"
      ],
      "entries": [
        {
          "claimId": "clm_tier_998ee1662a55",
          "score": 1,
          "sourceId": "example-guide-a",
          "tier": "T0"
        },
        {
          "claimId": "clm_tier_baccc092f287",
          "score": 0.6,
          "sourceId": "example-stats-b",
          "tier": "A"
        }
      ],
      "evidenceType": "cross_source_consensus",
      "id": "cns_tier_ea2808ac970a",
      "maxScore": 1,
      "meanScore": 0.8,
      "minScore": 0.6,
      "mode": "shiyu_defense",
      "patch": "3.3",
      "role": "anomaly"
    }
  ]
}
